Negation type	Category	Sentence
without	Salient absence	several men without shirts wrestle on the grass as a crowd watches
without	Other	a man lounges in his room without eating for days .
miss	Salient absence	a small female child , missing her front teeth , wearing pink shawl , blue jumper dress , her dark hair in two ponytails , smiling , making craft products with an older female who wears a white baseball cap , pink shirt and white jacket , inside a school gymnasium .
no	Negation of action/behavior	a boy selling lemonade for $ 1 rides his bike with no hands as he advertises his product to a long line of people .
not	Negation of attitude	a blond girl sits at a bar next to a few other men who are not paying attention to her and she is sad .
no	Salient absence	a man with no shirt holds a light pole as he stands on part of the stage .
no	Salient absence	a man wearing no shirt and a hat jumps in the air on a red bicycle .
not	Other	this dude is asian , and works on computers all the time , not stereotyping .
n't	(Preventing) future events	children holding onto a tether so that they do n't get lost at a festival .
miss	False positive	a large group of people are gathered in two slightly misshapen circles , in front a stage where a band is performing .
lack	False positive	a lack dog leaps in front of a tree branch in the snow .
no	Salient absence	a man with a hat , and no shoes lays on the ground after he wets himself .
without	Negation of action/behavior	two men , one with a black shirt and the other with a white shirt , are kicking each other without making contact .
miss	Salient absence	a chef standing behind a large pan of pepperoni pizza with one-fourths of the pizza missing .
no	Salient absence	a man with no shirt is leaning on a half-door .
n't	Negation of attitude	children eating at a outdoor cafe & someone does n't like the menu .
lack	False positive	a black dog about to jump into a lack to get a small ball .
not	Outside the frame	inside a vehicle , a blond woman with a single-lens reflex ( slr ) camera is gesturing at someone ( not visible ) behind her seat .
no	Quotes and idioms	a man skateboarding against a construction wall reading no bikes .
no	Salient absence	a man in a hot spring tub smiling with no shirt .
without	Salient absence	a young man , without apparent protective gear , is on a bicycle jumping over small hills of sand or gravel , with a long bridge and tall buildings in the background .
not	Other	workers making dangerous icy steps not so dangerous .
no	Salient absence	a well tanned man , with sunglasses and no shirt on , is holding wire and smiling .
no	Quotes and idioms	a man with a white no sleeve shirt and red shorts about to hit a volleyball .
n't	Other	this man is fishing around a bunch of boats , he has n't caught one , yet .
no	Salient absence	three children wearing swim trunks and no shirts play in the surf .
no	Quotes and idioms	a woman in a short dress standing by a no parking sign .
not	(Preventing) future events	this guy is trying to not get booted in the rear by this bull , looks like he is doing pretty good .
not	Other	middle-aged women ( maroon shirt ) holding child ( white shirt ) and a young women ( green shirt ) in the not too far distance .
no	Salient absence	a biker is wearing all black gear with buildings and a tree with no leaves nearby .
no	Salient absence	women playing a game similar to hockey , but with no ice .
n't	(Preventing) future events	here is a picture of locals hanging out in front of a store , talking on the phone and making sure their graffiti sign does n't get tagged .
not	Other	a bicycle rider flies over a hill while a competitor is not far behind .
no	Salient absence	a kid sitting with no shirt or shoes on examining something he has found .
no	Salient absence	a man with no shirt on is tying a yellow transparent bag closed .
not	Outside the frame	a boy raises his arms amongst a crowd of people who are not in focus .
no	Salient absence	a boy with no shirt is standing in water .
not	Negation of action/behavior	two young women wearing white tennis shirts are touching hands but not making eye-contact while a man in the behind them walks by .
without	Salient absence	two men , one with a hat and one without , holds up bottles and a beaker while a woman stands beside them with a wineglass filled with a peach liquid .
without	Salient absence	girl scaling rock wall without ropes .
no	Salient absence	young man with no shirt skateboarding off a ramp outdoors .
without	Salient absence	a man is shoveling snow without a hat or gloves .
no	Negation of action/behavior	a young boy at a skate park is flying high on his bike while using no hands !
no	Salient absence	two men wearing shorts and no shirts playing beach volleyball .
no	Salient absence	a girl wearing a blue tank top and kahki shorts has two tattoos and has no shoes on , is looking in a toy isle at transformers .
without	Salient absence	two ladies dressed similarly without shoes on , doing a dance on a stage .
no	Salient absence	a skinny young man running with no shirt on
not	Not a description/Meta	there is not an image here .
no	Salient absence	a man in shorts with no shirt is standing in front of a group of people on the beach .
miss	Salient absence	four boys look at the basketball hoop , which is missing the netting .
without	Salient absence	man without shirt standing on top of a drum that people are holding in the air .
not	Negation of action/behavior	a man and a woman are smiling for the camera but the woman is not looking at the camera .
no	Salient absence	man running with no shirt wearing number 129 on his shorts .
no	Quotes and idioms	three people standing in the snow behind a no skiing sign .
neither	Negation of action/behavior	a man and woman pose for a picture together , with neither smiling .
without	Salient absence	musician playing guitar without the drummer .
no	Salient absence	a man wearing black pants and no shoes appears to float in a laundry room .
no	Salient absence	a black man with no shirt is carrying a torch in front of bedazzled elephants .
no	Salient absence	a brown furry dog is biting a no hair brown dog .
no	Salient absence	a group of people on a cliff one with no shirt and khaki shorts , one in a black ball cap , white shirt and black shorts and another in a striped shirt , black shorts holding a video camera .
nowhere	Quotes and idioms	a group of six people have jumped into the air in the middle of nowhere and one is catching a ball .
no	Salient absence	a baby is lifted into the air by a man wearing no shirt .
miss	Quotes and idioms	man smoking a cigarette in a subway station near a missing poster .
not	Other	a man is fishing off a beach into a large body of water while a young boy carries a net not too far away .
no	Quotes and idioms	a man in a blue uniform lean against a wall with a no smoking sign .
without	Not a description/Meta	what 's a trip to the park without visiting the snack bar ?
n't	Negation of attitude	tourist wife upset with husband who ca n't makeup his mind .
without	Negation of action/behavior	a group of three people pose for a picture with smile while another sits aside without smiling .
not	Negation of action/behavior	a goalie on a hockey team with the colors of blue , white and yellow , ice skated pass the goal and did not manage to block the puck from the opposing team from going into his goal .
not	Outside the frame	a construction worker pointing to an object or area not seen in photo .
without	Salient absence	a man is welding without the proper safety equipment on .
no	Salient absence	a young black man wearing no shirt and low-riding jeans is popping a wheelie on a bicycle while listening to music through an earbud .
no	Salient absence	man in hat and overalls with no shirt standing with man in striped shirt
without	Salient absence	a man without a shirt on is rock climbing .
not	Negation of action/behavior	a group of adults holding musical instruments , they do not appear to be playing the instruments .
without	Salient absence	two girls are standing in shallow water without shoes .
nothing	Salient absence	a man in nothing but a pair of shorts and green crocs stands on a bridge covered with snow .
no	Salient absence	two boys wearing black shorts and no shirts kicking a ball over a net .
without	Salient absence	a man without a shirt runs through water spraying out of a large silver dome .
without	Salient absence	a man wearing red pants without a top is holding on to a ladder .
not	Not a description/Meta	not having such a good day .
without	Salient absence	a man in blue shorts and without a shirt is jogging down the road while listening to his ipod .
no	Salient absence	a man on a motorcycle with no shirt on at a bike event .
miss	Negation of action/behavior	two female volleyball players on the court with the one in the front falling because she missed the ball .
no	Quotes and idioms	a professional tennis player returns a shot with a back hand from no man 's land .
no	Salient absence	a man , in cutoff jeans and no shirt , is standing in a crowd on the beach .
fail	Negation of action/behavior	two girls play softball , one slides into plate as other fails to catch ball .
not	Salient absence	a quartet of young people , possibly spanish or portuguese , wearing red bandannas , while one conspicuously does not , stroll down a boulevard .
n't	(Preventing) future events	skinny dark complected boy , jumping into a vast of water with his nose held so water does n't rush in .
not	Quotes and idioms	"many people take pictures as a blond woman wearing a cover-up only costume holds a sign proclaiming "" photographers not predators "" on a pier ."
without	Salient absence	an old guitar player without a shirt on is pointing , sweating .
without	Salient absence	three people wearing helmets and crime stoppers jerseys are walking down a street in a parade , with another woman wearing a green shirt and without a helmet .
not	Outside the frame	three boys on a basketball court , wearing team uniforms , are attempting to reach a basketball which is not photographed but appears to be descending just out of their reach .
n't	Other	an elderly gentleman displays that he still has n't lost his knowledge of how to operate , with just a couple of horses and an old plow , free of automation .
without	Salient absence	a boy scaling down rocks without any climbing gear .
not	Other	a group of guys are not he football field playing football .
without	Salient absence	a skateboarder without a shirt grabs his board in the air .
no	Salient absence	a man in a blue shirt with a yellow bag is alone near some trees with no leaves .
without	Salient absence	a young boy plays in the snow without a shirt on .
miss	False positive	a person in the ocean wearing a protective vest is being lifted by a helicopter as part of a rescue mission .
not	Outside the frame	there are 3 people in this picture , a man who is looking through some object , another looking at something else perhaps not in the picture , and a little girl with her mouth open wide .
no	Salient absence	a man with long , blond-hair and no shirt , walk behind a black truck .
no	Salient absence	two caucasian males , one wearing a denim baseball cap and purple shirt , second guy with no baseball cap , wearing safety goggles , straddling a wood pallet .
without	Salient absence	four men are sitting in front of two large windows ; one man is playing a guitar , one is playing the bongo drums , and two are sitting back without instruments .
without	Salient absence	a man without a shirt standing on a roof .
without	Salient absence	man without shirt climbing rock face .
not	Salient absence	three men , one wearing a hat and two who are not , are kneeling on the ground digging in the dirt surrounding a cement platform .
no	Salient absence	person with no hair and makeup sits next to others in front of portable toilets .
no	Other	five kids jumping for no real reason
no	Salient absence	no traffic because it is sunday and the man is waiting to cross the road .
no	False positive	a yellow bus with no 3113 on the bus stop and people hopping in .
not	Salient absence	skateboarder not wearing a shirt does a cool trick .
n't	Negation of property	a middle-aged man 's shaving his beard in a room with white walls which does n't look like a bathroom .
n't	Not a description/Meta	people on a highway celebrating ( i honestly do n't know )
without	Salient absence	a guy without a shirt sleeping in front of a window .
not	Negation of property	two people covered in paint stand behind a male who is not covered in paint , all waiting for a fresh fruit smoothie or juice .
no	Salient absence	a man with no shirt and purple pants crouches while tampering with a metallic object .
not	Negation of property	a man pulls a yellow hose , there is a shadow in the background that is clearly not his own .
miss	Salient absence	a young girl with a front tooth missing dressed in a plaid skirt and blue shirt riding on a shopping cart in a grocery store .
no	Salient absence	a man with no shirt plays basketball .
without	Salient absence	a table of computer laptops and their users , in the background are people without computers .
no	Negation of action/behavior	a young man flies through the air in a no hands stunt on a bike .
without	Salient absence	some people are standing up in a truck , or a large vehicle that is without a roof , that has normal ist anders painted on the right side of the windshield .
no	Negation of action/behavior	a woman in the picture has fallen down and no one is stopping to help her up .
not	Negation of property	this fruit market is not busy yet .
no	Salient absence	no protection football guy getting tackled
no	Salient absence	man with no shirt and woman wearing all black are running in the sand .
no	Salient absence	a man with no shirt is wearing gloves and holding a mask .
sans	Salient absence	a group of young asian men who are sans shirts and wearing identical black and white plaid pants with red belts are dancing and waving their arms in the air around a fire .
no	Quotes and idioms	an older woman in a green shirt leaning against a white concrete block wall that has a sign on it that says no estacione .
without	Salient absence	man during sunny afternoon top of roof fixing light without shirt .
without	Salient absence	three chefs in a kitchen , the left most chef is flipping something in a frying pan , the middle chef is the only one without a hat , his hands are blurred from movement , the right most chef is wearing glasses and arranging food artfully on a plate .
not	Negation of action/behavior	two women who did not aim the camera at their faces .
no	Salient absence	a man with a beard and no shirt on has his bicycle upside down and is repairing it .
no	Salient absence	you african american boy with no shirt on smiling while holding a bowl of food .
not	(Preventing) future events	a stewardess on an airplane pushes a cart down the center isle , looking carefully so as not to bump any of the passengers .
not	Salient absence	a little baby on a tricycle seems to not be wearing any clothes .
no	Salient absence	a man wearing no shirt is trimming his beard with an electric trimmer while standing in a driveway .
no	Salient absence	a man is on stage with no shirt on grabbing a pool at what looks like a tv sporting event .
no	Salient absence	a man with no shirt sits on a black moped .
miss	Negation of action/behavior	two men playing soccer , and one man just missed the goal .
no	Salient absence	two children running with no shoes on .
without	Salient absence	a woman is in a deep sleep without her shoes on .
no	Salient absence	a skateboarder attempts a trick with no shirt on .
n't	Quotes and idioms	three young boys are engaged in a game of do n't drop the melon .
no	Quotes and idioms	the young boy looks at the woman like she has no idea what he 's been through .
no	Salient absence	a large horse with gear , but no rider .
no	Quotes and idioms	"three individuals are posing on skis behind a "" no skiing "" sign ."
fail	Negation of action/behavior	dark-skinned individual having a failed high jump attempt .
n't	Other	a woman looks to have jumped on top of somebody holding a beer , the bar does n't seem too far behind .
n't	Not a description/Meta	a cloudy day in a city does n't keep away crowds of men and women on the sidewalks .
not	Other	a man and a woman sit on a bus , but not together .
no	Quotes and idioms	"three boy do "" hear no evil , see no evil , speak no evil . """
not	(Preventing) future events	the cowboy in blue is trying not to be thrown off of the horse .
no	Salient absence	the man with no shirt and flip-flops looks at the women in white shorts .
miss	Negation of action/behavior	a girl hitting a softball but she missed the ball .
no	Salient absence	a man with no shirt sits on a rock in front of a blue building with a tin roof .
lack	Quotes and idioms	"an older woman with arm crutches is dressed in white and going through her white purse in front of a poster that reads "" lack of money is the root of all evil . """
no	Salient absence	a young boy with no shirt and white shorts .
miss	False positive	three college students studied quietly together missing out on a bright sunny day .
lack	False positive	a lack dog and a brown and white dog run on a gravel surface with something red underfoot .
no	Salient absence	a man wearing no shoes and has his shirt unbuttoned is laying down in front of a doorway that is looking outside .
not	Negation of action/behavior	there is a little boy in a swimming pool area everything around the boy and the pool are wet however the boy is not swimming but instead he is jumping into the water with blue swimming trunks on and his arms out .
not	Not a description/Meta	smoking is not good for health , it harms your lungs .
not	Salient absence	a man not wearing a shirt is pouring something out a can while sitting on sand in front of a orange and red tent .
n't	Not a description/Meta	a man in striped socks and a brown and white jumper is using some kind of object i ca n't identify properly .
not	Negation of attitude	a woman teaching a young girl not to be afraid of puppies .
not	Other	a baseball player ( not the pitcher ) is winding up to throw the ball to another player .
miss	Salient absence	a bike rider with khaki green shorts , a blue shirt , backpack and helmet is riding on the street near a red station wagon that is missing a hubcap on the back drivers side .
miss	False positive	two coast guard officers out on a training mission .
no	Quotes and idioms	"protesters with "" no new coal "" signs in urban area ."
no	Quotes and idioms	"three people in skiing gear are standing behind a "" no skiing "" sign ."
no	Salient absence	a busy street of people and two men are wearing no shirts .
n't	Negation of attitude	woman who just took pizza out of the oven and ca n't wait to eat it .
not	(Preventing) future events	a person trying desperately not to be photographed by putting their sweater over their head as they compute .
without	Salient absence	two little kids without shirts are sitting down facing each other .
n't	Negation of action/behavior	two women are standing outside looking at something with funny expressions on their faces while the other people around them do n't seem to notice .
nothing	Negation of action/behavior	a tall and bored looking man is just standing around doing nothing .
no	Salient absence	"a tattooed man in overalls , no shirt and a baseball cap is holding a microphone in front of a crowd and giving the "" peace "" sign with his other hand ."
no	Salient absence	a young girl plays in the snow wearing gloves and no coat .
not	Outside the frame	there are several people in the photograph and you can not see their faces , but some of them are waving their arms around .
without	Salient absence	a man without a shirt on is doing work on the side of a building .
no	Salient absence	a guy standing outside with no shirt on looking up at the building .
without	Negation of action/behavior	a kid eating out of a plate without using his hands .
no	Salient absence	there is a man in a kilt with tattoos and no shirt walking down the street carrying his skateboard .
not	Negation of action/behavior	a man and a woman wearing coats are facing standing outside facing each other , but not looking at each other .
without	Salient absence	a man without a shirt poses with his arms spread next to a woman .
miss	Negation of action/behavior	a cowboy is on the ground in a rodeo ring , holding onto his horse by a rope , just missing a calf .
no	Salient absence	two young men stand outside a home in the middle of winter with no coats on and wait to be let in .
not	(Preventing) future events	a cowboy tries not to fall off of the bucking cow , while spectators , a man on a horse , and a rodeo helper observe .
without	Salient absence	an african american man is running near the water without a shirt .
no	Salient absence	a man wearing blue pants and no shirt is painting a floor blue .
no	Salient absence	people are hiking up a mountain with no greenery .
no	Salient absence	a man wearing no shirt and reading a newspaper is standing in a park .
no	Outside the frame	no faces are shown in this picutre of jeans and sweatshirts .
n't	Negation of action/behavior	a man aims his camera at something in front of him but he is n't looking through the camera .
no	Salient absence	a young man with no shirt on is wearing black pants and sneakers is jumping over a blue skateboard .
no	Salient absence	hawaiian man wearing a lauhala with no shirt surrounded by tress is playing a wooded instrument while woman watches him .
no	Salient absence	blue tractor digging in front of a building with a mural of a man laying down with no clothes on .
no	Salient absence	a man lies in an alley next to two plastic bags , wearing one shoe and no shirt .
not	Outside the frame	a lone , 2-3 year old blond child in a blue jacket is putting a small black plastic item in his mouth as he kneels on a waiting room couch pointed toward the back while looking at something or someone not in the room .
without	Salient absence	a man without a shirt on is guiding a large brown horse pulling a green and yellow wagon .
no	Salient absence	a man with no shirt speed skateboards downhill .
without	Salient absence	a man in a yellow shirt and a man in a plaid shirt walk past a man without a shirt who is holding a cup .
without	Salient absence	a wet , smiling child without a shirt poses with arms raised .
miss	Salient absence	old woman missing teeth stands with metal object in hand .
no	Salient absence	many men , with black bags over their head and no shoes are being lead to a specific destination .
miss	False positive	a newsstand so packed with magazines , candy and coke-a-cola products that the smiling woman working behind the counter is easy to miss .
no	Quotes and idioms	a woman with a red no sleeve shirt with black shorts is running .
not	Negation of action/behavior	three women with headscarfs holding packages , two smiling , one not .
n't	Negation of attitude	people outside , this young woman does n't look too happy .
no	Salient absence	man with lots of tattoos and no shirt , wearing a skirt .
without	Salient absence	a man without a shirt on is riding a bicycle .
without	Salient absence	an old man is walking home in the rain without an umbrella .
without	Salient absence	a man climber a large rock without any gear while his friends watch
no	Salient absence	an older gentleman in a coat is carrying a walking cane , garbage bag and end table with no top .
not	Not a description/Meta	karate is not for the light-hearted !
without	Salient absence	a man is rock climbing without gear .
no	Salient absence	a small boy , wearing shorts and no shirt , is running outdoors .
miss	False positive	a soldier training a german shepherd for a mission .
no	Salient absence	a man and women wearing jeans and no helmets are riding on a suzuki street bike .
miss	Negation of action/behavior	a female batter misses a yellow ball while another player practices behind her .
without	Salient absence	a child wearing blue tee-shirt playing with an orange pinata without a blindfold .
without	Salient absence	a white male is wearing jean coat and pant while welding without eye protection .
miss	Negation of action/behavior	a cricket player misses the pitch .
no	Salient absence	a man walking in the sand with no shoes on .
not	Salient absence	a man , not wearing a shirt , is sitting on a rock and looking through a makeshift telescope .
without	Salient absence	four men in cargo shorts without shirts on are standing on metal scaffolding .
no	Salient absence	a guy with no shirt on is skateboarding .
not	Negation of attitude	fat man climbs a tree , but his fat girl friend and dumb dogs wearing sweaters are not impressed .
not	Negation of attitude	a young japanese man does not like his picture taken .
no	Salient absence	a man in a brown shirt and jeans kneels with no shoes on a rug near a blue wall and a black gate .
never	Quotes and idioms	"a man , talking on a cellphone , passes a brick building , with a sign on it , repeating , "" never sleep again . """
no	Salient absence	a man wearing jeans and no shirt is midair doing a kick flip on a skateboard .
not	Salient absence	woman in nice clothes does not have an umbrella .
no	Other	a man with curly hair and glasses tries to tug a large rope on a boat to no avail .
no	Salient absence	a child with a striped shirt and no shoes on rides the shoulders of a man with a red sweatshirt .
without	Negation of action/behavior	a baseball player reaches the base without being touched by the opposing player .
